[
  {
    "title": "QA Engineer",
    "company": "TechCorp",
    "source": "RemoteOK",
    "url": "https://remoteok.com/remote-jobs/qa-engineer-techcorp",
    "location": "Worldwide",
    "salary": "",
    "tags": "QA, Testing, Automation, Cypress",
    "description": "We are looking for a QA Engineer to join our team. Experience with Cypress, Selenium, and API testing is required.",
    "date": "2026-05-25",
    "raw_date": 1779571200,
    "is_qa": 1,
    "applied": 0,
    "cover_letter": "",
    "notes": "",
    "tech_stack": null,
    "seniority": null,
    "contract_type": null,
    "remote_type": null,
    "salary_min": null,
    "salary_max": null,
    "currency": null,
    "ai_enriched": 0,
    "saved": 0
  },
  {
    "title": "Software Development Engineer in Test",
    "company": "StartupXYZ",
    "source": "RemoteOK",
    "url": "https://remoteok.com/remote-jobs/sdet-startupxyz",
    "location": "Worldwide",
    "salary": "",
    "tags": "SDET, Python, Pytest, API, CI/CD",
    "description": "We need an SDET to build and maintain our test automation framework.",
    "date": "2026-05-24",
    "raw_date": 1779484800,
    "is_qa": 1,
    "applied": 0,
    "cover_letter": "",
    "notes": "",
    "tech_stack": null,
    "seniority": null,
    "contract_type": null,
    "remote_type": null,
    "salary_min": null,
    "salary_max": null,
    "currency": null,
    "ai_enriched": 0,
    "saved": 0
  },
  {
    "title": "Test Automation Engineer",
    "company": "BigCo Inc",
    "source": "RemoteOK",
    "url": "https://remoteok.com/remote-jobs/test-automation-engineer-bigco",
    "location": "Worldwide",
    "salary": "",
    "tags": "Selenium, Java, TestNG, Maven",
    "description": "Senior Test Automation Engineer needed for our platform team.",
    "date": "2026-05-23",
    "raw_date": 1779398400,
    "is_qa": 1,
    "applied": 0,
    "cover_letter": "",
    "notes": "",
    "tech_stack": null,
    "seniority": null,
    "contract_type": null,
    "remote_type": null,
    "salary_min": null,
    "salary_max": null,
    "currency": null,
    "ai_enriched": 0,
    "saved": 0
  },
  {
    "title": "Quality Assurance Lead",
    "company": "FinServ Ltd",
    "source": "RemoteOK",
    "url": "https://remoteok.com/remote-jobs/qa-lead-finserv",
    "location": "Worldwide",
    "salary": "",
    "tags": "QA Lead, Test Strategy, Management, JIRA",
    "description": "Looking for a QA Lead to manage our testing team.",
    "date": "2026-05-22",
    "raw_date": 1779312000,
    "is_qa": 1,
    "applied": 0,
    "cover_letter": "",
    "notes": "",
    "tech_stack": null,
    "seniority": null,
    "contract_type": null,
    "remote_type": null,
    "salary_min": null,
    "salary_max": null,
    "currency": null,
    "ai_enriched": 0,
    "saved": 0
  },
  {
    "title": "Software Tester",
    "company": "GameDev Studio",
    "source": "RemoteOK",
    "url": "https://remoteok.com/remote-jobs/software-tester-gamedev",
    "location": "Worldwide",
    "salary": "",
    "tags": "Manual Testing, Game Testing, Bug Tracking",
    "description": "Manual software tester for game development studio.",
    "date": "2026-05-21",
    "raw_date": 1779225600,
    "is_qa": 1,
    "applied": 0,
    "cover_letter": "",
    "notes": "",
    "tech_stack": null,
    "seniority": null,
    "contract_type": null,
    "remote_type": null,
    "salary_min": null,
    "salary_max": null,
    "currency": null,
    "ai_enriched": 0,
    "saved": 0
  },
  {
    "title": "Senior QA Engineer",
    "company": "CloudScale",
    "source": "RemoteOK",
    "url": "https://remoteok.com/remote-jobs/senior-qa-engineer-cloudscale",
    "location": "Worldwide",
    "salary": "",
    "tags": "Performance Testing, Load Testing, k6, AWS",
    "description": "Senior QA Engineer with performance testing experience.",
    "date": "2026-05-20",
    "raw_date": 1779139200,
    "is_qa": 1,
    "applied": 0,
    "cover_letter": "",
    "notes": "",
    "tech_stack": null,
    "seniority": null,
    "contract_type": null,
    "remote_type": null,
    "salary_min": null,
    "salary_max": null,
    "currency": null,
    "ai_enriched": 0,
    "saved": 0
  },
  {
    "title": "QA Engineer Manual & Automation",
    "company": "HealthTech Solutions",
    "source": "RemoteOK",
    "url": "https://remoteok.com/remote-jobs/qa-engineer-mixed-healthtech",
    "location": "Worldwide",
    "salary": "",
    "tags": "Manual, Automation, Playwright, TypeScript",
    "description": "Hybrid QA role: manual exploratory testing and automation.",
    "date": "2026-05-19",
    "raw_date": 1779052800,
    "is_qa": 1,
    "applied": 0,
    "cover_letter": "",
    "notes": "",
    "tech_stack": null,
    "seniority": null,
    "contract_type": null,
    "remote_type": null,
    "salary_min": null,
    "salary_max": null,
    "currency": null,
    "ai_enriched": 0,
    "saved": 0
  },
  {
    "title": "QA Manager",
    "company": "EduPlatform",
    "source": "RemoteOK",
    "url": "https://remoteok.com/remote-jobs/qa-manager-eduplatform",
    "location": "Worldwide",
    "salary": "",
    "tags": "QA Management, Leadership, Agile, ISTQB",
    "description": "QA Manager to lead a distributed team of 8 QA engineers.",
    "date": "2026-05-18",
    "raw_date": 1778966400,
    "is_qa": 1,
    "applied": 0,
    "cover_letter": "",
    "notes": "",
    "tech_stack": null,
    "seniority": null,
    "contract_type": null,
    "remote_type": null,
    "salary_min": null,
    "salary_max": null,
    "currency": null,
    "ai_enriched": 0,
    "saved": 0
  },
  {
    "title": "Backend Developer",
    "company": "NonQA Company",
    "source": "RemoteOK",
    "url": "https://remoteok.com/remote-jobs/backend-dev-nonqa",
    "location": "Worldwide",
    "salary": "",
    "tags": "Python, Django, PostgreSQL, REST API",
    "description": "Looking for a backend developer. Not a QA role.",
    "date": "2026-05-17",
    "raw_date": 1778880000,
    "is_qa": 0,
    "applied": 0,
    "cover_letter": "",
    "notes": "",
    "tech_stack": null,
    "seniority": null,
    "contract_type": null,
    "remote_type": null,
    "salary_min": null,
    "salary_max": null,
    "currency": null,
    "ai_enriched": 0,
    "saved": 0
  },
  {
    "title": "Frontend Engineer",
    "company": "WebAgency",
    "source": "RemoteOK",
    "url": "https://remoteok.com/remote-jobs/frontend-engineer-webagency",
    "location": "Worldwide",
    "salary": "",
    "tags": "React, TypeScript, CSS, Next.js",
    "description": "Frontend engineer to build UIs. Not a QA position.",
    "date": "2026-05-16",
    "raw_date": 1778793600,
    "is_qa": 0,
    "applied": 0,
    "cover_letter": "",
    "notes": "",
    "tech_stack": null,
    "seniority": null,
    "contract_type": null,
    "remote_type": null,
    "salary_min": null,
    "salary_max": null,
    "currency": null,
    "ai_enriched": 0,
    "saved": 0
  }
]
