[
  {"title":"Game Tester","company":"Crossing Hurdles","source":"RemoteOK","url":"https://remoteok.com/remote-jobs/remote-game-tester-crossing-hurdles-1131883","location":"Worldwide","salary":"","tags":"","date":"2026-05-23","raw_date":1779519786,"is_qa":1},
  {"title":"Test Automation Engineer","company":"540","source":"RemoteOK","url":"https://remoteok.com/remote-jobs/remote-test-automation-engineer-540-1131147","location":"Worldwide","salary":"","tags":"","date":"2026-04-16","raw_date":1776297640,"is_qa":1},
  {"title":"1068 Intake and QA expert","company":"GoFasti","source":"RemoteOK","url":"https://remoteok.com/remote-jobs/remote-1068-intake-and-qa-expert-gofasti-1131109","location":"Worldwide","salary":"","tags":"","date":"2026-04-15","raw_date":1776211206,"is_qa":1},
  {"title":"Lithuanian Localization QA Tester Proofreader","company":"Welo Global","source":"RemoteOK","url":"https://remoteok.com/remote-jobs/remote-lithuanian-localization-qa-tester-proofreader-welo-global-1130966","location":"Worldwide","salary":"","tags":"","date":"2026-04-01","raw_date":1775059213,"is_qa":1},
  {"title":"Junior Manual QA Engineer","company":"Topstep","source":"RemoteOK","url":"https://remoteok.com/remote-jobs/remote-junior-manual-qa-engineer-topstep-1130823","location":"Worldwide","salary":"","tags":"","date":"2026-03-18","raw_date":1773849648,"is_qa":1},
  {"title":"QA Engineer","company":"Mex Digital FZE","source":"RemoteOK","url":"https://remoteok.com/remote-jobs/remote-qa-engineer-mex-digital-fze-1130438","location":"Worldwide","salary":"","tags":"","date":"2026-02-19","raw_date":1771488033,"is_qa":1},
  {"title":"QA Document Control Specialist","company":"Apogee Therapeutics","source":"RemoteOK","url":"https://remoteok.com/remote-jobs/remote-qa-document-control-specialist-apogee-therapeutics-1130421","location":"Worldwide","salary":"","tags":"","date":"2026-02-19","raw_date":1771459438,"is_qa":1},
  {"title":"QA Engineer","company":"Mex Digital FZE","source":"RemoteOK","url":"https://remoteok.com/remote-jobs/remote-qa-engineer-mex-digital-fze-1130390","location":"Worldwide","salary":"","tags":"","date":"2026-02-18","raw_date":1771430418,"is_qa":1},
  {"title":"Quality Assurance Specialist","company":"SanMar Employee Board","source":"RemoteOK","url":"https://remoteok.com/remote-jobs/remote-quality-assurance-specialist-sanmar-employee-board-1130335","location":"Worldwide","salary":"","tags":"","date":"2026-02-17","raw_date":1771286452,"is_qa":1},
  {"title":"Quality Assurance Specialist","company":"SanMar","source":"RemoteOK","url":"https://remoteok.com/remote-jobs/remote-quality-assurance-specialist-sanmar-1130330","location":"Worldwide","salary":"","tags":"","date":"2026-02-17","raw_date":1771286412,"is_qa":1},
  {"title":"QA Analyst","company":"Proof of Play","source":"RemoteOK","url":"https://remoteok.com/remote-jobs/remote-qa-analyst-proof-of-play-1130098","location":"Worldwide","salary":"","tags":"","date":"2026-02-05","raw_date":1770278437,"is_qa":1},
  {"title":"Senior Automation Engineer Java","company":"Ubiminds","source":"RemoteOK","url":"https://remoteok.com/remote-jobs/remote-senior-automation-engineer-java-ubiminds-1130093","location":"Worldwide","salary":"","tags":"","date":"2026-02-05","raw_date":1770249626,"is_qa":1},
  {"title":"QA Engineer","company":"MrBeast","source":"RemoteOK","url":"https://remoteok.com/remote-jobs/remote-qa-engineer-mrbeast-1129980","location":"Worldwide","salary":"","tags":"","date":"2026-02-01","raw_date":1769954474,"is_qa":1},
  {"title":"SDET Intern","company":"Prophecy","source":"RemoteOK","url":"https://remoteok.com/remote-jobs/remote-sdet-intern-prophecy-1129977","location":"Worldwide","salary":"","tags":"","date":"2026-02-01","raw_date":1769954445,"is_qa":1},
  {"title":"Software QA Engineer","company":"Anduril Industries","source":"RemoteOK","url":"https://remoteok.com/remote-jobs/remote-software-qa-engineer-anduril-industries-1129970","location":"Worldwide","salary":"","tags":"","date":"2026-02-01","raw_date":1769950848,"is_qa":1},
  {"title":"Software Test Engineer","company":"Affinitiv","source":"RemoteOK","url":"https://remoteok.com/remote-jobs/remote-software-test-engineer-affinitiv-1129959","location":"Worldwide","salary":"","tags":"","date":"2026-02-01","raw_date":1769947206,"is_qa":1},
  {"title":"QA Manager Quality Assurance","company":"Grow Therapy","source":"RemoteOK","url":"https://remoteok.com/remote-jobs/remote-qa-manager-quality-assurance-grow-therapy-1129932","location":"Worldwide","salary":"","tags":"","date":"2026-02-01","raw_date":1769932826,"is_qa":1},
  {"title":"QA Engineer","company":"Upshop","source":"RemoteOK","url":"https://remoteok.com/remote-jobs/remote-qa-engineer-upshop-1129922","location":"Worldwide","salary":"","tags":"","date":"2026-02-01","raw_date":1769922005,"is_qa":1},
  {"title":"Quality Assurance Analyst","company":"OppFi","source":"RemoteOK","url":"https://remoteok.com/remote-jobs/remote-quality-assurance-analyst-oppfi-1129709","location":"Worldwide","salary":"","tags":"","date":"2026-01-23","raw_date":1769126428,"is_qa":1},
  {"title":"Senior Quality Engineer","company":"Khan Academy","source":"RemoteOK","url":"https://remoteok.com/remote-jobs/remote-senior-quality-engineer-khan-academy-1129592","location":"Worldwide","salary":"","tags":"","date":"2026-01-15","raw_date":1768518006,"is_qa":1},
  {"title":"Quality Assurance Engineer Manual","company":"Elligint Health","source":"RemoteOK","url":"https://remoteok.com/remote-jobs/remote-quality-assurance-engineer-manual-elligint-health-1129457","location":"Worldwide","salary":"","tags":"","date":"2026-01-07","raw_date":1767772832,"is_qa":1},
  {"title":"SDET II SDET III","company":"Netomi","source":"RemoteOK","url":"https://remoteok.com/remote-jobs/remote-sdet-ii-sdet-iii-netomi-1129275","location":"Worldwide","salary":"","tags":"","date":"2025-12-18","raw_date":1766044837,"is_qa":1},
  {"title":"Software Quality Engineer","company":"Gurobi Optimization","source":"RemoteOK","url":"https://remoteok.com/remote-jobs/remote-software-quality-engineer-gurobi-optimization-1129177","location":"Worldwide","salary":"","tags":"","date":"2025-12-12","raw_date":1765497625,"is_qa":1},
  {"title":"Senior Test Engineer","company":"Endpoint Clinical","source":"RemoteOK","url":"https://remoteok.com/remote-jobs/remote-senior-test-engineer-endpoint-clinical-1129061","location":"Worldwide","salary":"","tags":"","date":"2025-11-27","raw_date":1764259221,"is_qa":1},
  {"title":"Quality Assurance Analyst II","company":"Filevine","source":"RemoteOK","url":"https://remoteok.com/remote-jobs/remote-quality-assurance-analyst-ii-filevine-1128896","location":"Worldwide","salary":"","tags":"","date":"2025-11-07","raw_date":1762473744,"is_qa":1}
]
